{
  "backend": "serial",
  "complete_all14": true,
  "environment": {
    "baudrate": 1000000,
    "device": "/dev/ttyACM0",
    "hardware_authorized": true,
    "platform": "Linux-6.1.83-aarch64-with-glibc2.35",
    "python": "3.10.12",
    "repository_commit": "ec4ecb779f601ddc2e0ff0d33d87ce9d7c690aa2",
    "suspended_or_benched": true,
    "timeout_ms": 4.0
  },
  "finding": "all_servos_input_voltage_error",
  "halt_reason": null,
  "hardware_gate_status": "NOT_ADVANCED_DIAGNOSTIC_ONLY",
  "informational_only": false,
  "read_order": [
    20,
    21,
    22,
    23,
    24,
    30,
    31,
    32,
    33,
    10,
    11,
    12,
    14,
    13
  ],
  "records": [
    {
      "device_status_raw": 1,
      "input_voltage_error": true,
      "logical_index": 0,
      "present_voltage_v": 8.3,
      "register_address": 62,
      "response_length": 1,
      "response_status": "device",
      "round_trip_ms": 0.627076,
      "servo_id": 20,
      "voltage_raw": 83,
      "wire_index": 0
    },
    {
      "device_status_raw": 1,
      "input_voltage_error": true,
      "logical_index": 1,
      "present_voltage_v": 8.3,
      "register_address": 62,
      "response_length": 1,
      "response_status": "device",
      "round_trip_ms": 0.41087,
      "servo_id": 21,
      "voltage_raw": 83,
      "wire_index": 1
    },
    {
      "device_status_raw": 1,
      "input_voltage_error": true,
      "logical_index": 2,
      "present_voltage_v": 8.200000000000001,
      "register_address": 62,
      "response_length": 1,
      "response_status": "device",
      "round_trip_ms": 0.465827,
      "servo_id": 22,
      "voltage_raw": 82,
      "wire_index": 2
    },
    {
      "device_status_raw": 1,
      "input_voltage_error": true,
      "logical_index": 3,
      "present_voltage_v": 8.4,
      "register_address": 62,
      "response_length": 1,
      "response_status": "device",
      "round_trip_ms": 0.38687,
      "servo_id": 23,
      "voltage_raw": 84,
      "wire_index": 3
    },
    {
      "device_status_raw": 1,
      "input_voltage_error": true,
      "logical_index": 4,
      "present_voltage_v": 8.3,
      "register_address": 62,
      "response_length": 1,
      "response_status": "device",
      "round_trip_ms": 0.383412,
      "servo_id": 24,
      "voltage_raw": 83,
      "wire_index": 4
    },
    {
      "device_status_raw": 1,
      "input_voltage_error": true,
      "logical_index": 5,
      "present_voltage_v": 8.200000000000001,
      "register_address": 62,
      "response_length": 1,
      "response_status": "device",
      "round_trip_ms": 0.38762,
      "servo_id": 30,
      "voltage_raw": 82,
      "wire_index": 5
    },
    {
      "device_status_raw": 1,
      "input_voltage_error": true,
      "logical_index": 6,
      "present_voltage_v": 8.200000000000001,
      "register_address": 62,
      "response_length": 1,
      "response_status": "device",
      "round_trip_ms": 0.385829,
      "servo_id": 31,
      "voltage_raw": 82,
      "wire_index": 6
    },
    {
      "device_status_raw": 1,
      "input_voltage_error": true,
      "logical_index": 7,
      "present_voltage_v": 8.200000000000001,
      "register_address": 62,
      "response_length": 1,
      "response_status": "device",
      "round_trip_ms": 0.38587,
      "servo_id": 32,
      "voltage_raw": 82,
      "wire_index": 7
    },
    {
      "device_status_raw": 1,
      "input_voltage_error": true,
      "logical_index": 8,
      "present_voltage_v": 8.200000000000001,
      "register_address": 62,
      "response_length": 1,
      "response_status": "device",
      "round_trip_ms": 0.379663,
      "servo_id": 33,
      "voltage_raw": 82,
      "wire_index": 8
    },
    {
      "device_status_raw": 1,
      "input_voltage_error": true,
      "logical_index": 9,
      "present_voltage_v": 8.3,
      "register_address": 62,
      "response_length": 1,
      "response_status": "device",
      "round_trip_ms": 0.382829,
      "servo_id": 10,
      "voltage_raw": 83,
      "wire_index": 9
    },
    {
      "device_status_raw": 1,
      "input_voltage_error": true,
      "logical_index": 10,
      "present_voltage_v": 8.3,
      "register_address": 62,
      "response_length": 1,
      "response_status": "device",
      "round_trip_ms": 0.392329,
      "servo_id": 11,
      "voltage_raw": 83,
      "wire_index": 10
    },
    {
      "device_status_raw": 1,
      "input_voltage_error": true,
      "logical_index": 11,
      "present_voltage_v": 8.200000000000001,
      "register_address": 62,
      "response_length": 1,
      "response_status": "device",
      "round_trip_ms": 0.377037,
      "servo_id": 12,
      "voltage_raw": 82,
      "wire_index": 11
    },
    {
      "device_status_raw": 1,
      "input_voltage_error": true,
      "logical_index": 13,
      "present_voltage_v": 8.200000000000001,
      "register_address": 62,
      "response_length": 1,
      "response_status": "device",
      "round_trip_ms": 0.374121,
      "servo_id": 14,
      "voltage_raw": 82,
      "wire_index": 12
    },
    {
      "device_status_raw": 1,
      "input_voltage_error": true,
      "logical_index": 12,
      "present_voltage_v": 8.3,
      "register_address": 62,
      "response_length": 1,
      "response_status": "device",
      "round_trip_ms": 0.387245,
      "servo_id": 13,
      "voltage_raw": 83,
      "wire_index": 13
    }
  ],
  "register_address": 62,
  "review_status": "REVIEW_REQUIRED",
  "run_status": "COMPLETE",
  "safety": {
    "final_torque_off_status": "ok",
    "goal_position_write_count": 0,
    "initial_torque_off_status": "ok",
    "torque_enable_requested": false
  },
  "schema_version": "open_duck_x5.voltage_diagnostic.v1",
  "volts_per_count": 0.1
}
