{
  "backend": "mock",
  "complete_all14": true,
  "environment": {
    "baudrate": 1000000,
    "device": "mock://sts3215",
    "hardware_authorized": false,
    "platform": "Windows-10-10.0.26200-SP0",
    "python": "3.10.11",
    "repository_commit": "NOT_APPLICABLE",
    "suspended_or_benched": false,
    "timeout_ms": 4.0
  },
  "finding": "no_input_voltage_error",
  "halt_reason": null,
  "hardware_gate_status": "NOT_ADVANCED_DIAGNOSTIC_ONLY",
  "informational_only": true,
  "read_order": [
    20,
    21,
    22,
    23,
    24,
    30,
    31,
    32,
    33,
    10,
    11,
    12,
    14,
    13
  ],
  "records": [
    {
      "device_status_raw": 0,
      "input_voltage_error": false,
      "logical_index": 0,
      "present_voltage_v": 7.4,
      "register_address": 62,
      "response_length": 1,
      "response_status": "ok",
      "round_trip_ms": 0.0068,
      "servo_id": 20,
      "voltage_raw": 74,
      "wire_index": 0
    },
    {
      "device_status_raw": 0,
      "input_voltage_error": false,
      "logical_index": 1,
      "present_voltage_v": 7.4,
      "register_address": 62,
      "response_length": 1,
      "response_status": "ok",
      "round_trip_ms": 0.0013,
      "servo_id": 21,
      "voltage_raw": 74,
      "wire_index": 1
    },
    {
      "device_status_raw": 0,
      "input_voltage_error": false,
      "logical_index": 2,
      "present_voltage_v": 7.4,
      "register_address": 62,
      "response_length": 1,
      "response_status": "ok",
      "round_trip_ms": 0.0008,
      "servo_id": 22,
      "voltage_raw": 74,
      "wire_index": 2
    },
    {
      "device_status_raw": 0,
      "input_voltage_error": false,
      "logical_index": 3,
      "present_voltage_v": 7.4,
      "register_address": 62,
      "response_length": 1,
      "response_status": "ok",
      "round_trip_ms": 0.0007,
      "servo_id": 23,
      "voltage_raw": 74,
      "wire_index": 3
    },
    {
      "device_status_raw": 0,
      "input_voltage_error": false,
      "logical_index": 4,
      "present_voltage_v": 7.4,
      "register_address": 62,
      "response_length": 1,
      "response_status": "ok",
      "round_trip_ms": 0.0007,
      "servo_id": 24,
      "voltage_raw": 74,
      "wire_index": 4
    },
    {
      "device_status_raw": 0,
      "input_voltage_error": false,
      "logical_index": 5,
      "present_voltage_v": 7.4,
      "register_address": 62,
      "response_length": 1,
      "response_status": "ok",
      "round_trip_ms": 0.0008,
      "servo_id": 30,
      "voltage_raw": 74,
      "wire_index": 5
    },
    {
      "device_status_raw": 0,
      "input_voltage_error": false,
      "logical_index": 6,
      "present_voltage_v": 7.4,
      "register_address": 62,
      "response_length": 1,
      "response_status": "ok",
      "round_trip_ms": 0.0007,
      "servo_id": 31,
      "voltage_raw": 74,
      "wire_index": 6
    },
    {
      "device_status_raw": 0,
      "input_voltage_error": false,
      "logical_index": 7,
      "present_voltage_v": 7.4,
      "register_address": 62,
      "response_length": 1,
      "response_status": "ok",
      "round_trip_ms": 0.0006,
      "servo_id": 32,
      "voltage_raw": 74,
      "wire_index": 7
    },
    {
      "device_status_raw": 0,
      "input_voltage_error": false,
      "logical_index": 8,
      "present_voltage_v": 7.4,
      "register_address": 62,
      "response_length": 1,
      "response_status": "ok",
      "round_trip_ms": 0.0007,
      "servo_id": 33,
      "voltage_raw": 74,
      "wire_index": 8
    },
    {
      "device_status_raw": 0,
      "input_voltage_error": false,
      "logical_index": 9,
      "present_voltage_v": 7.4,
      "register_address": 62,
      "response_length": 1,
      "response_status": "ok",
      "round_trip_ms": 0.0009,
      "servo_id": 10,
      "voltage_raw": 74,
      "wire_index": 9
    },
    {
      "device_status_raw": 0,
      "input_voltage_error": false,
      "logical_index": 10,
      "present_voltage_v": 7.4,
      "register_address": 62,
      "response_length": 1,
      "response_status": "ok",
      "round_trip_ms": 0.0007,
      "servo_id": 11,
      "voltage_raw": 74,
      "wire_index": 10
    },
    {
      "device_status_raw": 0,
      "input_voltage_error": false,
      "logical_index": 11,
      "present_voltage_v": 7.4,
      "register_address": 62,
      "response_length": 1,
      "response_status": "ok",
      "round_trip_ms": 0.0007,
      "servo_id": 12,
      "voltage_raw": 74,
      "wire_index": 11
    },
    {
      "device_status_raw": 0,
      "input_voltage_error": false,
      "logical_index": 13,
      "present_voltage_v": 7.4,
      "register_address": 62,
      "response_length": 1,
      "response_status": "ok",
      "round_trip_ms": 0.0007,
      "servo_id": 14,
      "voltage_raw": 74,
      "wire_index": 12
    },
    {
      "device_status_raw": 0,
      "input_voltage_error": false,
      "logical_index": 12,
      "present_voltage_v": 7.4,
      "register_address": 62,
      "response_length": 1,
      "response_status": "ok",
      "round_trip_ms": 0.0007,
      "servo_id": 13,
      "voltage_raw": 74,
      "wire_index": 13
    }
  ],
  "register_address": 62,
  "review_status": "INFORMATIONAL_ONLY",
  "run_status": "COMPLETE",
  "safety": {
    "final_torque_off_status": "ok",
    "goal_position_write_count": 0,
    "initial_torque_off_status": "ok",
    "torque_enable_requested": false
  },
  "schema_version": "open_duck_x5.voltage_diagnostic.v1",
  "volts_per_count": 0.1
}
